ID,IdentNr,Titel,Beteiligte,Bereich,MatTech,Objekttyp,Datierung
2428308,Dep. 18 FV,Venus und Adonis in waldiger Landschaft,Unbekannter Künstler,GGFremdbesitz,"Leinwand, Leinwand",Malerei,
1837559,B 67,Charlotte Dorothea von Schönburg (1743-1783),Unbekannter Künstler,GGFremdbesitz,"Leinwand, Leinwand",Malerei,20. Jahrhundert
1837565,B 68,Bildnis eines Herrn,Unbekannter Künstler,GGFremdbesitz,"Leinwand, Leinwand",Malerei,20. Jahrhundert
1838558,L 198,Bildnis einer Edeldame,Unbekannter Künstler,GGFremdbesitz,"Leinwand, Leinwand",Malerei,
1838529,L 309,Dame mit Hermelinsmantel,Unbekannter Künstler,GGFremdbesitz,"Leinwand, Leinwand",Malerei,
863839,A 1,Cimon und Pero / Caritas Romana,Unbekannter Künstler,GGFremdbesitz,"Leinwand, Leinwand",Malerei,1601/1700
2012913,Unb 24,Bildnis Johannes Stabius,Unbekannter Künstler,GGFremdbesitz,"Ölfarbe auf Holz, Ölfarbe auf Holz",Allgemein,1669
2613370,R.I.2000.1,Holländischer Hohlkehlenrahmen mit Ebenholzfurnier,,GGFremdbesitz,"Holz, Ebenholzfurnier",,17. Jahrhundert
2613364,R.I.2000.5,Holländischer Ebenholzrahmen,,GGFremdbesitz,"Holz, schwarz poliert",,17. Jahrhundert
2613365,R.I.51.96,Deutscher Leistenrahmen,,GGFremdbesitz,"Holz, geschnitzt, vergoldet",Rahmen,17. Jahrhundert
865266,B (ohne Nummer) a,Landschaft mit Kavallerie,Unbekannter Künstler,GGFremdbesitz,"Leinwand, Leinwand",Malerei,um 1860
866869,B (ohne Nummer) b,Bedienter hält ein weißes Pferd / Parklandschaft,Unbekannter Künstler,GGFremdbesitz,"Leinwand, Leinwand",Malerei,1701/1800
865600,B (ohne Nummer) c,Kücheninterieur,"Schooten, Floris Gerritsz. van",GGFremdbesitz,"Eichenholz, Eichenholz",Malerei,um 1610
868657,B 9,Bildnis eines Herren,Unbekannter Künstler,GGFremdbesitz,"Leinwand, Leinwand",Malerei,1801/1850
870191,B 11,Bildnis Gaspar M. Glasenap,Unbekannter Künstler,GGFremdbesitz,"Leinwand, Leinwand",Malerei,1719
869146,B 12,Bildnis?,Unbekannter Künstler,GGFremdbesitz,"Leinwand, Leinwand",Malerei,1500/1900
870483,B 17,Baumreiche Landschaft?,Unbekannter Künstler,GGFremdbesitz,"Leinwand, Leinwand",Malerei,1550/1750
862667,B 19,Bildnis eines Herren,Unbekannter Künstler,GGFremdbesitz,"Leinwand, Leinwand",Malerei,1701/1800
862892,B 24,Danae empfängt auf ihrem Lager Jupiter in der Gestalt eines Goldregens,Tizian,GGFremdbesitz,"Leinwand, Leinwand",Malerei,
870081,B 26,Kreuzaufrichtung,"Rubens, Peter Paul",GGFremdbesitz,"Holz, Holz",Malerei,1601/1700
868890,B 27,Bildnis des Domkapellmeisters Joseph Ignatz Schnabel 1767-18 31,Unbekannter Künstler,GGFremdbesitz,"Leinwand, Leinwand",Malerei,1900/1915
868750,B 28,Bildnis Bischof Martinus Gerstman,Unbekannter Künstler,GGFremdbesitz,"Leinwand, Leinwand",Malerei,1501/1600
869381,B 29,"Bildnis des Bischofs Karl III., Erzherzog von Österreich",Unbekannter Künstler,GGFremdbesitz,"Leinwand, Leinwand",Malerei,1601/1700
866423,B 34,"Bildnis Friedrich I., König von Preußen","Weidemann, Friedrich Wilhelm",GGFremdbesitz,"Leinwand, Leinwand",Malerei,1701/1800
867236,B 35,Bildnis des Bischofs Johannes VI.,Unbekannter Künstler,GGFremdbesitz,"Leinwand : Hartfaserpappe, Leinwand : Hartfaserpappe",Malerei,1608
870538,B 37,Bildnis Balthaser von Promnitz,Unbekannter Künstler,GGFremdbesitz,"Leinwand, Leinwand",Malerei,1501/1600
871577,B 38,Bildnis des Ernst Daniel Eberhard Burg im Alter von 9 Jahren,Unbekannter Künstler,GGFremdbesitz,"Leinwand, Leinwand",Malerei,1779
862294,B 42,Bildnis des Dogen Francesco Molino,Unbekannter Künstler,GGFremdbesitz,"Leinwand, Leinwand",Malerei,1646
868917,B 43,Bildnis der Albertine Marguerite de Bruges. Geb. 1666,Unbekannter Künstler,GGFremdbesitz,"Leinwand, Leinwand, Gemaltes Oval",Malerei,1701/1800
869348,B 44,Bildnis des Albert Francois de la Saulx. 1659-1690,Unbekannter Künstler,GGFremdbesitz,"Leinwand, Leinwand, Gemaltes Oval",Malerei,1701/1800
871212,B 46,Bildnis Marin Falier,Unbekannter Künstler,GGFremdbesitz,"Leinwand, Leinwand",Malerei,nach 1700
866079,B 58,Bildnis einer Dame mit Fächer,"Lange, H.",GGFremdbesitz,"Leinwand, Leinwand",Malerei,1701/1800
863327,B 65,Triumphzug der Galathea,Unbekannter Künstler,GGFremdbesitz,"Leinwand, Leinwand",Malerei,1601/1700
864634,Co 68,Bildnis Kaiser Leopold I. von Österreich,"Püchler, Johann Michael",GGFremdbesitz,"Papier auf Holz, Papier : Holz",Malerei,1680/1702
871886,Co 89,Merkur auf der Weltkugel tänzelnd,Unbekannter Künstler,GGFremdbesitz,"Email, Contreémail (opak hellblau), Wachsrelief auf Email",Allgemein,1634
866778,Dep. 1 FB o.Nr.,König Salomo und die Königin von Saba,"Gotthard, Joseph",GGFremdbesitz,"Leinwand, Leinwand",Malerei,1822
865622,Dep. 2 Unb o.Nr.,Reitergefecht in Landschaft mit Festungsanlage,"Calza, Antonio",GGFremdbesitz,"Leinwand, Leinwand",Malerei,um 1700
865102,Dep. 3 Unb o.Nr.,Christus und die Samariterin am Brunnen,Unbekannter Künstler,GGFremdbesitz,"Leinwand, Leinwand",Malerei,1701/1800
871977,Dep. 4 Unb o.Nr.,Venus und Adonis,Unbekannter Künstler,GGFremdbesitz,"Leinwand, Leinwand",Malerei,um 1700
867274,Dep. 5 Unb o.Nr.,Cimon und Pera,Unbekannter Künstler,GGFremdbesitz,"Leinwand, Leinwand",Malerei,1601/1650
863635,Dep. 6 Unb o.Nr.,Moses mit der Schlange vor Pharao,"Spooner, Thomas",GGFremdbesitz,"Leinwand, Leinwand",Malerei,
870157,Dep. 7 Unb o.Nr.,"Stehende Frau unter Bäumen, auf einen Fluß blickend","Burmann, Fritz",GGFremdbesitz,"Leinwand, Leinwand",Malerei,1940
869172,Dep. 8 Unb o.Nr.,Bildnis Anton von Werner mit Malgerät,"Koner, Max Johann Bernhard",GGFremdbesitz,"Leinwand, Leinwand",Malerei,1896
864557,Dep. 9 Unb o.Nr.,Sibilla Frigia (Phrygische Sybille),Unbekannter Künstler,GGFremdbesitz,"Leinwand, Leinwand",Malerei,1601/1700
868129,Dep. 10 Unb o.Nr,Falkner mit Hunden und Jagdbeute,Unbekannter Künstler,GGFremdbesitz,"Leinwand, Leinwand, Unregelmäßig geschwungenes Format",Malerei,1701/1750
863225,Dep. 11 Unb o.Nr.,Beweinung Christi,"Böttcher-Achenbach, H.",GGFremdbesitz,"Leinwand, Leinwand",Malerei,
870811,Dep. 12 Unb o.Nr.,Der Heilige Antonius von Padua mit dem Christuskind,"Böttcher-Achenbach, H.",GGFremdbesitz,"Leinwand, Leinwand",Malerei,
870113,Dep. 13 Unb o.Nr.,Der Heilige Antonius von Padua mit dem Christuskind,"Murillo, Bartolomé Esteban",GGFremdbesitz,"Leinwand, Leinwand",Malerei,17. Jahrhundert
863181,Dep. 14 Unb o.Nr.,Innenraum einer Kirche mit Gläubigen,"Erdmann, R.?",GGFremdbesitz,"Leinwand, Leinwand",Malerei,1913
871930,Dep. 15 FV,Maria lactans,"Janssens, Abraham (der Ältere)",GGFremdbesitz,"Eichenholz, Eichenholz",Malerei,17. Jahrhundert
868477,Dep. 16 FV,Rinderkopf,"Ommeganck, Balthasar Paul",GGFremdbesitz,"Tempera mit Harzöllasur & Büttenpapier auf Pappe, Harzöllasur, Tempera, Büttenpapier, Pappe ",Malerei,
870521,Dep. 17 FV,Kreuztragender Christus mit der hl. Veronika,Unbekannter Künstler,GGFremdbesitz,"Leinwand, Tempera (blaugrau) mit Harzöllasur & Leinwand, Leinwand",Malerei,um 1700
868064,Dep. 20 FV,Deckenskizze mit Göttern und Putten in den Wolken,Unbekannter Künstler,GGFremdbesitz,"Leinwand, Leinwand",Malerei,1601/1615
862648,Dep. 21 FV,Madonna mit der Nelke,Raffael,GGFremdbesitz,"Leinwand, Leinwand",Malerei,um 1600
867955,Dep. 28 FV OFD,Generalmajor Heinrich August Baron de la Motte-Fouqué (1698-1774),"Pesne, Antoine",GGFremdbesitz,"Leinwand, Öl auf Leinwand",Malerei,um 1751
869108,Dep. 29 FV OFD,Bildnis Amalie Prinzessin von Preußen (1723-1787),"Therbusch, Anna Dorothea",GGFremdbesitz,"Leinwand, Leinwand, Ölfarbe",Malerei,1771
871064,Dep. 30 FV OFD,Landschaft mit dem Traum Jacobs,"Willmann, Michael Lucas Leopold",GGFremdbesitz,"Leinwand, Öl auf Leinwand",Malerei,Nach 1692
864227,DI 1,Landschaft mit Staffage,Unbekannter Künstler,GGFremdbesitz,"Holz, Holz",Malerei,1651/1700
868168,E 1,"Maria mit dem Kind, dem Johannesknaben und vier Heiligen",Unbekannter Künstler,GGFremdbesitz,"Leinwand, Leinwand",Malerei,1501/1600
870267,F 1,Bildnis eines Herrn mit Allongeperücke,Unbekannter Künstler,GGFremdbesitz,"Leinwand, Leinwand",Malerei,um 1680
870711,F 2,Bildnis Joachim Friedrich von Brandenburg (1546 - 1608),Unbekannter Künstler,GGFremdbesitz,"Leinwand, Leinwand",Malerei,17. Jahrhundert
868549,F 3,"Bildnis Friedrich II., König von Preußen","Pesne, Antoine",GGFremdbesitz,"Leinwand, Leinwand",Malerei,um 1755
862461,G 1,Der gefesselte Herkules ringt mit den Pygmäen,"Cranach, Lucas (der Jüngere)",GGFremdbesitz,"Holz, Holz",Malerei,1551/1600
862461,G 1,Der gefesselte Herkules ringt mit den Pygmäen,"Cranach, Lucas (der Jüngere)",GGFremdbesitz,"Holz, Holz",Malerei,nach 1551
863794,Harrach 1,Kreuzigung Christi,"Vaccaro, Andrea (1598)",GGFremdbesitz,"Leinwand, Leinwand, Ursprünglich Lunettenform. Spätere bemalte Zwickelanstückungen",Malerei,
864404,J 1,Reitergefecht vor einem Dorf,"Meulener, Pieter",GGFremdbesitz,"Holz, Holz",Malerei,1612?
867540,J 2,Seeschlacht,"Peeters, Jan (1)",GGFremdbesitz,"Leinwand, Leinwand",Malerei,1656
863818,J 4,Reisegesellschaft mit Zigeunerlager an einer Furt,"Wouwerman, Philips",GGFremdbesitz,"Leinwand, Leinwand",Malerei,um 1650
868851,K 2,Bildnis eines vierzigjährigen Mannes,Unbekannter Künstler,GGFremdbesitz,"Holz, Holz",Malerei,um 1580
865784,K 3,Putto mit Blumen und Früchten in Landschaft,"Stern, Ignaz",GGFremdbesitz,"Leinwand, Leinwand",Malerei,
865231,K 4,"Bildnis einer jungen Frau im Innenraum, rechts Fenster mit Ausblick auf eine Stadt",Unbekannter Künstler,GGFremdbesitz,"Holz, Holz",Malerei,um 1550
869171,K 6,Bildnis eines Herren mit rötlichem Lockenhaar und weißem Seidenschal,Unbekannter Künstler,GGFremdbesitz,"Leinwand, Leinwand",Malerei,1601/1700
864556,K 8,Kreuzigungsszene,Meister von 1518,GGFremdbesitz,"Holz, Holz",Malerei,um 1520
869497,Mü 1,Profilbildnisse Ludwig XIV. und der Marquise de Montespan,"Chodowiecki, Marianne",GGFremdbesitz,"Bleistiftzeichnung auf Karton, Blei & Karton",Zeichnung,1816
866389,NG 1,Titanenkampf,"Jordaens, Jacob (der Ältere)",GGFremdbesitz,"Leinwand, Leinwand",Malerei,1601/1700
864035,NG 5,Interieur mit musizierendem Mann und Dame mit Weinglas,Unbekannter Künstler,GGFremdbesitz,"Eichenholz, Eichenholz",Malerei,1701/1800
864870,NG 7,Junges Paar mit Diener,"Muttoni, Pietro",GGFremdbesitz,"Leinwand, Leinwand",Malerei,17. Jahrhundert
863557,NG 8,Zwei Putten mit Rosen,"Mura, Francesco de",GGFremdbesitz,"Holz, von Leinwand übertragen, Holz, von Leinwand übertragen",Malerei,um 1750
863558,NG 9,Zwei Putten mit Trauben,"Mura, Francesco de",GGFremdbesitz,"Holz, von Leinwand übertragen, Holz, von Leinwand übertragen",Malerei,um 1750
863559,NG 10,Vier Putten mit Vögeln,"Mura, Francesco de",GGFremdbesitz,"Holz, von Leinwand übertragen, Holz, von Leinwand übertragen",Malerei,um 1750
863560,NG 11,Vier Putten mit Musikinstrumenten,"Mura, Francesco de",GGFremdbesitz,"Holz, von Leinwand übertragen, Holz, von Leinwand übertragen",Malerei,um 1750
865400,NG 12,Bildnis einer Dame mit Hermelinmantel,Unbekannter Künstler,GGFremdbesitz,"Leinwand, Leinwand",Malerei,1701/1800
869264,NG 13,Bildnis einer Dame,Unbekannter Künstler,GGFremdbesitz,"Leinwand, Leinwand",Malerei,1701/1800
868299,PB 1,"Sich schmückende Frau, Vanitas?",Unbekannter Künstler,GGFremdbesitz,"Leinwand, Leinwand",Malerei,1601/1700
872009,Priv 1,Die Heilige Cäcilie,"Rubens, Peter Paul",GGFremdbesitz,"Leinwand, Leinwand",Malerei,1639 - 1640
869380,Priv 2,Noahs Fluch und Segen über seine Söhne,Unbekannter Künstler,GGFremdbesitz,"Leinwand auf Holz, Leinwand auf Holz",Malerei,1601/1700
871637,Priv 4,Eva im Paradies mit Schlange unterm Apfelbaum,"Coxcie, Michiel (1)",GGFremdbesitz,"Lindenholz, Lindenholz",Malerei,1501/1600
863759,Priv 5,Maria Immaculata auf der Weltkugel mit Schlange und Mondsichel unter den Füßen,Unbekannter Künstler,GGFremdbesitz,"Nadelholz, Nadelholz",Malerei,um 1720
864939,Priv 7,Bildnis Graf Finkelstein,"Bärwinkel, C.",GGFremdbesitz,"Leinwand, Leinwand",Malerei,1874
869041,Priv 7 a,Bildnis eines königlich-sächsischen Offiziers,Unbekannter Künstler,GGFremdbesitz,"Leinwand, Leinwand",Malerei,1701/1800
868321,Priv 7 b,Bildnis eines königlich-sächsischen Offiziers,Unbekannter Künstler,GGFremdbesitz,"Leinwand, Leinwand",Malerei,1601/1700
862785,Priv 7 c,Bildnis eines königlich-sächsischen Offiziers,Unbekannter Künstler,GGFremdbesitz,"Leinwand, Leinwand",Malerei,1701/1800
870394,Priv 9,Die Heilige Katharina,"Dolci, Carlo",GGFremdbesitz,"Leinwand auf Sperrholz, Leinwand : Holz, achteckig, Komposition links und rechts beschnitten",Malerei,um 1650
870744,Priv 12,Bildnis einer alten Frau mit Ausblick auf Landschaft,"Keil, Bernhard",GGFremdbesitz,"Leinwand, Leinwand",Malerei,
866986,Priv 13,Bildnis einer vornehmen Dame mit Hündchen,Unbekannter Künstler,GGFremdbesitz,"Leinwand, Leinwand",Malerei,um 1600
871686,Priv 17,Pfingstwunder,Unbekannter Künstler,GGFremdbesitz,"Leinwand, Leinwand, Teil einer Raumdekoration. Sechseckig, über drei Bögen",Malerei,1601/1700
870810,R 39,Bildnis Kürassier-General Lüderitz,Unbekannter Künstler,GGFremdbesitz,"Leinwand, Leinwand",Malerei,um 1740
868444,R 53,Bildnis des preußischen Generalfeldmarschalls Helmut Graf von Moltke,"Hummel, Fritz",GGFremdbesitz,"Leinwand, Leinwand",Malerei,
866686,R 58,Bildnis Friedrich Wilhelm I. König von Preußen,"Pesne, Antoine",GGFremdbesitz,"Leinwand, Leinwand",Malerei,
867055,R 64,Anbetung der Könige,Unbekannter Künstler,GGFremdbesitz,"Pappelholz, Pappelholz",Malerei,um 1430
866023,U-Min 1,Bildnis Gräfin von Neitschütz,Unbekannter Künstler,GGFremdbesitz,"Elfenbein, Elfenbein",Malerei,1801/1815
867418,U-Min 2,Bildnis einer jungen Dame mit federgeschmücktem Hut,"Frijur, ?",GGFremdbesitz,"Elfenbein, Elfenbein",Malerei,
869075,U-Min 3,"Bildnis einer Dame mit Spitzenhaube, sitzend im Sessel, rechts ein Landschaftsausblick","Peter, Emmanuel",GGFremdbesitz,"Elfenbein, Elfenbein",Malerei,
869809,U-Min 4,Bildnis einer Dame mit Spitzenhaube,"Hallberg, Joseph",GGFremdbesitz,"Elfenbein, Elfenbein, rund",Malerei,1825
871687,U-Min 5,Junges Paar in Landschaft,Unbekannter Künstler,GGFremdbesitz,"Elfenbein, Elfenbein",Malerei,1701/1800
865401,U-Min 6,Bildnis einer Dame mit Perlenkette,Mayer,GGFremdbesitz,"Elfenbein, Elfenbein",Malerei,
862966,U-Min 8,Bildnis eines Herrn mit Schärpe und Haarflechtband,Unbekannter Künstler,GGFremdbesitz,"Kupfer, Kupfer, oval",Malerei,um 1700
866870,U-Min 9,Johannes der Täufer mit dem Lamm,"Kraus, Wenzel",GGFremdbesitz,"Elfenbein, Elfenbein",Malerei,
863543,U-Min 16,Bildnis eines bärtigen Herrn,Unbekannter Künstler,GGFremdbesitz,"Kupfer, Kupfer, oval",Malerei,1601/1700
864635,U-Min 21,Bildnis eines jungen Mannes,Unbekannter Künstler,GGFremdbesitz,"Silber, Silber, Gemalt in die Hälfte eines Augsburger SIlber-Schraubtalers",Malerei,1601/1615
868550,U-Min 22,Bildnis eines jungen Mädchens,Unbekannter Künstler,GGFremdbesitz,"Silber, Silber, Gemalt in die Hälfte eines Augsburger Silber-Schraubtalers von 1621",Malerei,1601/1650
865301,U-Min 23,Bildnis eines jungen Mannes,Unbekannter Künstler,GGFremdbesitz,"Kupfer, Kupfer, oval",Malerei,1601/1650
864229,U-Min 24,Bildnis eines jungen Mannes mit Goldkette und Kreuz,Unbekannter Künstler,GGFremdbesitz,"Papier auf Pappe, Papier, Pappe , Oval. Auf mit Samt kaschierte Pappe geklebt. Zustand: Bildträger verwölbt",Malerei,1801/1900
868169,U-Min 25,Madonna mit Kind und Johannesknaben,"Pedrini, Giovanni",GGFremdbesitz,"Elfenbein, Elfenbein",Malerei,16. Jahrhundert
862398,U-Min 26,Der hl. Antonius von Padua,Unbekannter Künstler,GGFremdbesitz,"Holz, Holz",Malerei,1601/1700
869499,U-Min 27,Bildnis eines Mannes,Mayer,GGFremdbesitz,"Elfenbein, Elfenbein",Malerei,
868102,U-Min 28,Grablegung Christi,Unbekannter Künstler,GGFremdbesitz,"Zink, Zink",Malerei,nach 1600
865060,U-Min 29,Bildnis eines jungen Mannes,Unbekannter Künstler,GGFremdbesitz,"Kupfer, Kupfer, Oval",Malerei,1601/1700
871993,U-Min 30,Bildnis einer Prinzessin zu Hohenlohe Langeburg?,Unbekannter Künstler,GGFremdbesitz,"Papier, Papier",Malerei,um 1840
862765,U-Min 31,"Dame mit Kind und Vogel, in Parklandschaft sitzend",Unbekannter Künstler,GGFremdbesitz,"Elfenbein, auf Pappe kaschiert, Elfenbein (auf Pappe kaschiert)",Malerei,1701/1750
871315,U-Min 32,Profilbildnis eines jungen Mannes mit Ohrring,Unbekannter Künstler,GGFremdbesitz,"Papier, Papier",Malerei,1801/1850
871487,Unb 2,Tanzende und musiziernde Amoretten an einem blumengeschmückten Altar mit loderndem Feuer,"Rottenhammer, Johann",GGFremdbesitz,"Holz, Holz",Malerei,
870922,Unb 3,Flügelaltar,"Coecke van Aelst, Pieter (1)",GGFremdbesitz,"Eichenholz, Eichenholz",Malerei,um 1520
862982,Unb 4,Orientalischer Markt beim Fondaco de'Turchi in Venedig,"Berger, Ernst",GGFremdbesitz,"Leinwand, Leinwand",Malerei,1882
862264,Unb 7,Anbetung der Könige,Unbekannter Künstler,GGFremdbesitz,"Eichenholz, Eichenholz",Malerei,um 1540
863866,Unb 10,Madonna mit Kind und Johannesknabe,Unbekannter Künstler,GGFremdbesitz,"Leinwand, Leinwand",Malerei,1601/1700
867157,Unb 11,Hl. Petrus betend mit Schlüssel,Unbekannter Künstler,GGFremdbesitz,"Leinwand, Leinwand",Malerei,1601/1700
866049,Unb 12,Ecce homo,Unbekannter Künstler,GGFremdbesitz,"Holz, Holz",Malerei,nach 1525
864149,Unb 13,Kreuztragung Christi,Unbekannter Künstler,GGFremdbesitz,"Zinkblech, Zinkblech",Malerei,
868037,Unb 14,Mann mit Querflöte und Noten,Unbekannter Künstler,GGFremdbesitz,"Leinwand, Leinwand",Malerei,1801/1850
864676,Unb 15,"Bergige Flußlandschaft mit Burg, Stadt und Schiffen","Schüz, Christian Georg (1)",GGFremdbesitz,"Leinwand, Leinwand",Malerei,1801/1900
870790,Unb 16,Reiterschlacht (Kopie nach Verdussen?),Unbekannter Künstler,GGFremdbesitz,"Leinwand, Leinwand",Malerei,1601/1700
871052,Unb 17,Profilbildnis eines Königs,Unbekannter Künstler,GGFremdbesitz,"Kupfer, Kupfer",Malerei,nach 1600
862514,Unb 18,Martin Luther im Kreise seiner Familie am Weihnachtsabend,"Plockhorst, Bernhard",GGFremdbesitz,"Kunstdruck, Kunstdruck",Malerei,
863163,Unb 19,Bildnis des Fürsten Victor Friedrich von Anhalt-Bernburg,"Schnoedt, Carl Ludwig",GGFremdbesitz,"Leinwand, Leinwand",Malerei,
866425,Unb 20,Interieur mit Stickerin,"Büttgen, J.",GGFremdbesitz,"Gouache auf Pappe, Pappe, Gouache",Malerei,1832
867237,Unb 21,Bäuerliches Fastnachtsmahl im Innenraum mit Ausblick auf Winterlandschaft,"Brueghel, Pieter (der Jüngere)",GGFremdbesitz,"Holz, Holz",Malerei,
865739,Unb 22,Marine / Segelschiffe am flachen Seestrand,"Moras, Walter",GGFremdbesitz,"Leinwand, Leinwand",Malerei,
870193,W 1,Segen des Sommers,Unbekannter Künstler,GGFremdbesitz,"Spanpressplatte, Spanpressplatte",Malerei,um 1930
863399,W 2,Bildnis eines sitzenden Mannes,"Hamacher, Alfred",GGFremdbesitz,"Leinwand, Leinwand",Malerei,1932
