ID,IdentNr,Titel,Beteiligte,Bereich,MatTech,Objekttyp,Datierung
1964604,Sign. 710 a,Achillis Bocchii: Bonon Symbolocarum Quaestionum de Universo. Bologna 1555,Unbekannt,KKBucherMappenvor1800,,Buch,1555
1949583,Sign. 72,Philip Melanchton: Vom Abendmahl des Herrn. Georg Rhaw: Wittenberg 1532,Unbekannt,KKBucherMappenvor1800,,Buch,1532
1949483,Sign. 73,Martin Luther: Epistel sanct Petri gepredigt und ausgelegt durch Luther. Nikolaus Schyrlentz: Wittenberg 1523,"Luther, Martin",KKBucherMappenvor1800,,Buch,1523
2021443,Sign. 739,Daniel Meissner: Thesaurus Philo-politicus. Eberhard Kiesern: Frankfurt 1624,Unbekannt,KKBucherMappenvor1800,,Buch,1624
2012414,Sign. 74,Martin Luther: Das dise wort Christi (das ist mein leib). Friedrich Peypus: Nürnberg 1527,Unbekannt,KKBucherMappenvor1800,,Buch,1527
1945899,Sign. 75,Biblische Historien.  Frankfurt: Christian Egenolff 1536,"Egenolff, Christian",KKBucherMappenvor1800,,Buch,1536
2021350,Sign. 752,Crispian van de Passe: Stammbuch der Junggesellen. Ludwig Runings: Basel o. J. [17. Jh.],Unbekannt,KKBucherMappenvor1800,,Buch,
1958996,Sign. 76,Ulrich van Hutten: Phalarismus Dialogue Huttenicus. o. O. 1517,"Hutten, Ulrich von",KKBucherMappenvor1800,,Buch,1517
1945141,Sign. 77,Dye legend und leben des heylige sandt Keyser Heinrichs ... Hans Pfeil: Bamberg 1509,Unbekannt,KKBucherMappenvor1800,,Buch,1509
1920281,Sign. 78,"Zwo Comedien des synn reichen poeten Plauti """"""""Menechmo und Bachide"""""""" und die Komödie """"""""Philegenia"""""""" genannt. Augsburg 1518, Grimm, Sigmund und Wirsung, Marx","Weiditz, Hans",KKBucherMappenvor1800,"+, Typendruck",Midas-Objekt,1518
1945240,Sign. 7a,"Joh. Huttichius: Imperatorum et Caesarum vitae, cum Imaginibus ... Wolfgang Köpfel: Strassburg 1534",Unbekannt,KKBucherMappenvor1800,,Buch,1534
2012352,Sign. 8,Ein seer gut un nutzlichs Bettbuchleyn. Jeronium Formschneyder: Nürnberg 1527,Unbekannt,KKBucherMappenvor1800,,Buch,1527
1945012,Sign. 80,Psalter des küniglichen prophetten davids ... Grimm u. Wirsung: Augsburg 1523,Unbekannt,KKBucherMappenvor1800,,Buch,1523
1920280,Sign. 81,Ludwig Moser: Bereitung z. d. hl. Sacrament mit andechtigen betrachtungen und gebetten ...  Basel: Michael Furter 1490,Unbekannt,KKBucherMappenvor1800,,Buch,1490
1967572,Sign. 811 a,Lodovico Dolce: Imprese di ...  Ziletti: Venedig 1562,Unbekannt,KKBucherMappenvor1800,,Buch,1562
2022129,Sign. 827,Johann Michael Dilherm: Heilig-Epistolischer Bericht/Licht/Geleit und Freud ... Nürnberg 1663,Unbekannt,KKBucherMappenvor1800,,Buch,1663
1945885,Sign. 83,Chronica (von an- und abgang aller Welt wesen). Frankfurt: Christian Egenolff(en) 1534,"Egenolff, Christian",KKBucherMappenvor1800,,Buch,1534
1955597,Sign. 85,Hortulus Animae - Lustgarten der Seelen. Georg Rhaw: Wittenberg 1547,Unbekannt,KKBucherMappenvor1800,,Buch,1547
1949480,Sign. 87,Martin Luther: Passional Christi und Antichristi. Johann Grünenberg: Wittenberg 1521,"Luther, Martin",KKBucherMappenvor1800,,Buch,1521
2034083,Sign. 87 fol. Br,Antichristus. In: Martin Luther: Passional Christi und Antichristi. Johann Grünenberg: Wittenberg 1521,"Luther, Martin",KKBucherMappenvor1800,Holzschnitt,Allgemein,1521
1960004,Sign. 88,Passional Christi und Antichristi. o. O.  o. J. [Straßburg ? nach 1521],Unbekannt,KKBucherMappenvor1800,,Buch,
1960005,Sign. 89,Passional Christi und Antichristi. o. O.  o. J. [Straßburg ? nach 1521],Unbekannt,KKBucherMappenvor1800,,Buch,
1960050,Sign. 892,Horae (Stundenbuch). o. O.  o. J. [um 1500],Unbekannt,KKBucherMappenvor1800,,Buch,
1960051,Sign. 893,Das andechtig zeygt glocklei des lebens und leydens Christi nach den 24 Stunden außgeteylt.. o. O.  o. J.,Unbekannt,KKBucherMappenvor1800,,Buch,
1958576,Sign. 895,"Livre de 'heures de Rome ... Simon Vostre, Phil. Pigouchet: Paris 1502",Unbekannt,KKBucherMappenvor1800,,Buch,1502
1958130,Sign. 896,"Livre d'heures de Rome: Simon Vostre, Phil. Pigouchet: Paris 1502",Unbekannt,KKBucherMappenvor1800,,Buch,1502
1958578,Sign. 897,Livre de 'heures de Rome ... :  o. O. [Paris] 1503,Unbekannt,KKBucherMappenvor1800,,Buch,1503
1582773,Sign. 898,"Stundenbuch. [Paris: Jean Pichore und Remy de Laistre, 1504].","Pichore, Jean",KKBucherMappenvor1800,"Holzschnit und Typendruck auf Pergament, Pergament, Typendruck",Buch,1504
1583008,Sign. 898 fol. Ro7 verso,"Seite aus dem Stundenbuch. [Paris: Jean Pichore und Remy de Laistre, 1504].","Pichore, Jean",KKBucherMappenvor1800,"Holzschnit und Typendruck auf Pergament, Pergament, Typendruck",Allgemein,1504
1955976,Sign. 899,Officia vom morem sancte Romane.  Joh. Gregorius de Gregoriis: Venedig 1505,Unbekannt,KKBucherMappenvor1800,,Buch,1505
1960006,Sign. 90,Passional Christi und Antichristi. o. O.  o. J. [Straßburg? nach 1521?],Unbekannt,KKBucherMappenvor1800,,Buch,
1958582,Sign. 900,Heures de Rouen - Livre d 'heures. Simon Vostre: Paris 1508,Unbekannt,KKBucherMappenvor1800,,Buch,1508
1946540,Sign. 901,Hortulus animae ... Martin Flach: Strassburg 1512,Unbekannt,KKBucherMappenvor1800,,Buch,1512
1957662,Sign. 901 b,Rosario de la gloriosa Vergine Maria: [ o. T. ?]. Melchior Sessa u. Piero Ravani: Venedig 1522,Unbekannt,KKBucherMappenvor1800,,Buch,1522
1957674,Sign. 901 c,Rosario de la gloriosa vergine Maria: [o.T. ?] Vittor della Serena e compagni: Venedig 1541,Unbekannt,KKBucherMappenvor1800,,Buch,
1960974,Sign. 902 c,Rosario della Gloriosa: Vergine Maria. Venedig: Dominico de' Franceschi 1572,Unbekannt,KKBucherMappenvor1800,,Buch,1572
1959004,Sign. 903,Horae in Laudem virginis mariae B.M.V. Bernard: Paris 1541,Unbekannt,KKBucherMappenvor1800,,Buch,1541
1958573,Sign. 906 a,"Livre d'heures de Rome - Les presentes heures a lusaige (ensaige?) de Romme ... Simon Vostre, Phil. Pigouchet: Paris 1502",Unbekannt,KKBucherMappenvor1800,,Buch,1502
1958575,Sign. 907,"Livre de 'heures de Rome ... Simon Vostre, Phil. Pigouchet: Paris 1502",Unbekannt,KKBucherMappenvor1800,,Buch,1502
1958694,Sign. 908,Livre d 'heures. Gillet Hardouin: Paris 1513-27,Unbekannt,KKBucherMappenvor1800,,Buch,
1957727,Sign. 911,Hore beate Marie virginis secundus usuz Hierosolymitanuz. St. di Statiognona Gorgoni: Lyon 1516,Unbekannt,KKBucherMappenvor1800,,Buch,1516
1958955,Sign. 914,Livres d'heures - Chore beatissime Marie virginis ... Germain Hardonin: Paris o. J. [1528?],Unbekannt,KKBucherMappenvor1800,,Buch,
1959036,Sign. 915,Horae beate Mariae virginia ad ... Thielmann Kerver: Paris 1542,Unbekannt,KKBucherMappenvor1800,,Buch,1542
1941761,Sign. 918,De sanctissima Trinitate. Preces et Officia var. edit Antiq. o. O. [Paris?] o. J. [1500?],Unbekannt,KKBucherMappenvor1800,"Pergament, Pergamentdruck",Buch,
1959044,Sign. 920,"Horae in Laudem beatissimae virginis Mariae, ad usum Romanum. Thielman Kerver: Paris 1550",Unbekannt,KKBucherMappenvor1800,,Buch,1550
1958579,Sign. 925,"Horae intemerate Virginis Marie ... Anabat, Gilles u. Germain Hardouyn: Paris 1505",Unbekannt,KKBucherMappenvor1800,,Buch,1505
1958583,Sign. 926,Heures de Rome ... Gillet Hardouyn: Paris 1509,Unbekannt,KKBucherMappenvor1800,,Buch,1509
1958779,Sign. 926 a,Livre d'heures. Simon Vostre: Paris [1512 ?],Unbekannt,KKBucherMappenvor1800,,Buch,
1958782,Sign. 927,Livre d 'heures - Heures de Rome. Gilles Hardouin: Paris 1514-29,Unbekannt,KKBucherMappenvor1800,,Buch,
1958783,Sign. 927 a,Livre d 'heures. Nicolas Hygmann: Paris 1515-1530,Unbekannt,KKBucherMappenvor1800,,Buch,
1958954,Sign. 930,Livres d'heure - Hore in laudem beatissime virginis Marie ... Simon du Bois: Paris 1527,Unbekannt,KKBucherMappenvor1800,,Buch,1527
1959039,Sign. 932,"Horae in laudem beatiss, virginiss Mariae. Oliver Mallard: Paris 1542",Unbekannt,KKBucherMappenvor1800,,Buch,1542
1958952,Sign. 932 a,Livre d'heures. Nicolas Hygman: Paris 1523 ?,Unbekannt,KKBucherMappenvor1800,,Buch,
1959043,Sign. 933,"Horae in Laudem beatissimae virginis Mariae, ad usum Romanum. Reginald Calderius: Paris 1549",Unbekannt,KKBucherMappenvor1800,,Buch,1549
1964659,Sign. 934,Bartholomeo Scalvo: Rosariae Preces - Ad Gloriosam dei Gentricem Mariam ... Mense Martij: Mailand 1569,Unbekannt,KKBucherMappenvor1800,,Buch,1569
2021223,Sign. 935,A Book of Christian Prayers. Richard Yardley: London 1590,Unbekannt,KKBucherMappenvor1800,,Buch,1590
1969576,Sign. 936,De la Grange: Officum Beatae Mariae Virginis. Paris: Mettayer 1597,Unbekannt,KKBucherMappenvor1800,,Buch,1597
2025060,Sign. 957,Totentanz. Lüneburg 1792,"Chodowiecki, Daniel Nikolaus",KKBucherMappenvor1800,,Buch,1792
1964285,Sign. 96,Johannes Agricola Sprembergensem: Abcontrafactur und Bildnis aller Groshertzogen/ Chur und Fürsten ... Sachsen. Gabriel Schnellboltz: Wittenberg 1563,Unbekannt,KKBucherMappenvor1800,,Buch,1563
1941682,Sign. 968,"Robert Gobin: Les Loups ravissans. A. Verard, Paris um 1500",Unbekannt,KKBucherMappenvor1800,,Buch,um 1500
1957785,Sign. 969,Les simulachres et Historiees Faces de la Mort ... M. u. G. Trechsel: Lyon 1538,Unbekannt,KKBucherMappenvor1800,,Buch,
1964284,Sign. 97,Johannes Agricola Sprembergensem: Warhaffte Bildnis etlicher Hochlöblicher Fürsten und Herren ... Gabriel Schnellboltz: Wittenberg 1562,Unbekannt,KKBucherMappenvor1800,,Buch,1562
1957789,Sign. 971,Icones Mortis ... Joh. Frellonium: Lyon 1547,Unbekannt,KKBucherMappenvor1800,,Buch,1547
1957816,Sign. 972,"Simolachri, Holbein: Histoire e Figure de la Morte. Giov. Frellone: Lyon 1549",Unbekannt,KKBucherMappenvor1800,,Buch,1549
1949423,Sign. 98,Gnolfi Cycnaei:Elegidion Guolfi Cycnaei. Johann Viridimontamus: Wittenberg 1511,Unbekannt,KKBucherMappenvor1800,,Buch,1511
1969698,Sign. 980,Holbein Totentanz - Imagines Mortis. Arnold Birckmann: Köln 1567,"Aemylio, Georgio",KKBucherMappenvor1800,"Papier, Holzschnitt, Typendruck",Buch,1567
1946504,"Sign. 99,1",Martin Luther: Explanatio dominicae orationis ... Melchior Lotther: Leipzig 1520,"Luther, Martin",KKBucherMappenvor1800,,Buch,1520
2044785,"Sign. 99,10","Melanchthon, Philipp: Institutiones Rhetoricae Philipp Melanchthons. Wittenberg o. J.","Melanchthon, Philipp",KKBucherMappenvor1800,,Buch,
2044942,"Sign. 99,11","Melanchthon, Philipp: Compendiaria Dialectices ratio, quae erum disserendi usum tradit. Basel 1521","Melanchthon, Philipp",KKBucherMappenvor1800,,Buch,
2045004,"Sign. 99,12","Melanchthon, Philipp: In Divi Pauli Apostoli Doctrinam. Andrea Cratander: Besel 1520","Melanchthon, Philipp",KKBucherMappenvor1800,,Buch,1520
2045006,"Sign. 99,13",Dialogi Huttenici. o. O. 1521,Unbekannt,KKBucherMappenvor1800,,Buch,1521
2045010,"Sign. 99,14",Hochstratus Ovans. Dialogus Festivissimus. o. O.  o. J.,Unbekannt,KKBucherMappenvor1800,,Buch,
2044778,"Sign. 99,2",Martin Luther: De Bonis Operi ... Johann Grünberg: Wittenberg 1521,"Luther, Martin",KKBucherMappenvor1800,,Buch,1521
2044781,"Sign. 99,3",Martin Luther: De Meditatione Dominice Passionis e vernaculo. Wittenberg 1521,"Luther, Martin",KKBucherMappenvor1800,,Buch,1521
2044782,"Sign. 99,4",Martin Luther: Tessar aderas Isolatoria pro laborantib'. Melchior Lotther: Leipzig 1520,"Luther, Martin",KKBucherMappenvor1800,,Buch,1520
2044783,"Sign. 99,5",Martin Luther: Decem Praecepta Wittenbergensi Praediciata Populo.. Melchior Lotther: Leipzig 1520,"Luther, Martin",KKBucherMappenvor1800,,Buch,1520
2044784,"Sign. 99,6",Martin Luther: Serma Martini Lutheri de praepa ad moriendin e vernacula in latinn versus. Melchior Lotther: Leipzig 1520,"Luther, Martin",KKBucherMappenvor1800,,Buch,1520
2044787,"Sign. 99,7","Martin Luther: De lieber tate Chritiana Dissertatio Martini Lutheri, per av torem recognita . o. O. 1521","Luther, Martin",KKBucherMappenvor1800,,Buch,1521
2044788,"Sign. 99,8",Martin Luther: Martini Lutheri Lugu Brationes in Psalm XXI. A. Petri: Basel 1522,"Luther, Martin",KKBucherMappenvor1800,,Buch,1522
2044947,"Sign. 99,9",In Bochbello grauissi ... o. O. 1520,Unbekannt,KKBucherMappenvor1800,,Buch,1520
1957766,"Sign. 999,1",Historiarum Veteris Testamenti Icones ... Melchior u. Gaspar Trechsel: Lyon 1539,Unbekannt,KKBucherMappenvor1800,,Buch,
1965282,"Sign. 999,2",Les simulachres u. Historices faces de la Mort ... Melchior u. Gaspar Trechsel: Lyon 1538,Unbekannt,KKBucherMappenvor1800,,Buch,
1965284,"Sign. 999,3",Hans Sebald Beham: Biblische Historien. Christian Egenolph: Frankfurt am Main 1536,Unbekannt,KKBucherMappenvor1800,,Buch,
1946398,Sign. A 3212,Johannis Faber: Malleus. Köln 1524 / Mainz 1525,Unbekannt,KKBucherMappenvor1800,,Buch,
1947554,Sign. A 3214,Dialogus Mythologicus Bartholomei Coloniésis ...  Hierony Victorii u. Joh. Singrenii: Wien 1512,Unbekannt,KKBucherMappenvor1800,,Buch,1512
1973582,"Sign. A 3215,2",Tractatus de spiritualibus ascensionibus et descensionibus von Gerardus (Bernardus?). Köln [um 1500],Unbekannt,KKBucherMappenvor1800,,Buch,
1973584,"Sign. A 3215,3",... de vita et beeficiis salvatoris ...,Unbekannt,KKBucherMappenvor1800,,Buch,
1920240,Sign. A 3216,Die vertroestingeh des ghelatenre menschen,Unbekannt,KKBucherMappenvor1800,"+, Typendruck",Midas-Objekt,1504
1941013,Sign. A 3217,Breviarum secundum ... Herbipolense. Würzburg o. J.,Unbekannt,KKBucherMappenvor1800,,Buch,
1946508,Sign. A 3218,Martin Luther: Der kleine Catechismus. Valentin Babst: Leipzig 1543,"Luther, Martin",KKBucherMappenvor1800,,Buch,1543
1958823,"Sign. A 3219,1",Chore Nostre ... Thielmann Kerver: Paris 1519,Unbekannt,KKBucherMappenvor1800,,Buch,1519
1970907,"Sign. A 3219,2",Misere (Notenhandschrift),Unbekannt,KKBucherMappenvor1800,,Buch,
2023706,Sign. A 3220,Sebastian Brant: Narren Speel-Schuyt [Narrenschiff]. Henrick Lodewiecsz van Haestens: Leyden 1610,Unbekannt,KKBucherMappenvor1800,,Buch,1610
1958825,Sign. A 3222,Horae. Gilles Hardouyn: Paris 1520,Unbekannt,KKBucherMappenvor1800,,Buch,1520
1960234,"Sign. A 3223,1",Piero Valeriano: Hieroglyphica sive de sacris Aegyptiorum literis commentarii. Basel 1556,Unbekannt,KKBucherMappenvor1800,,Buch,1556
1959227,"Sign. A 3223,2",Celsitudo illustrissimarum Familiarum ad festa nuptialia ill. et eccellent. D. Stanislai Potocki et D. Josephae Mniszchowna. Leopoli 1774,Unbekannt,KKBucherMappenvor1800,,Buch,1774
2022813,Sign. AM 1518-1981,Typi sanctorum septem sacramentorum ... Rom 1619,Unbekannt,KKBucherMappenvor1800,,Buch,1619
1964371,Sign. AM 2-1983,Biblia. Wittenberg o. J. [1568],"Luther, Martin",KKBucherMappenvor1800,,Buch,1568
2037770,Sign. AM 213-1977,Gloria in excelsis deo [u.a. Blätter],Unbekannt,KKBucherMappenvor1800,,Buch,
2025088,Sign. AM 221-1972,Biblia. Wie solche von Herrn Doctor Martin Luther Seel. im Jahr Christi 1522 in unsere Teutsche ... J. A. Endter: Nürnberg 1725,"Luther, Martin",KKBucherMappenvor1800,,Buch,1725
2044439,Sign. AM 7-1978,o.T. [Leopold exendit] o. O.  o. J. [18. Jh.],Unbekannt,KKBucherMappenvor1800,,Buch,
2022715,Sign. B (?) 170,Filippo Baldinucci: Cominciamento e progresso del l`Arte dell`intagliare in rame ... Florenz 1686,Unbekannt,KKBucherMappenvor1800,,Buch,1686
1945233,Sign. B 10,Daniel Barbaro: La Pratica della perspettiva. Con 2 tav. Venedig 1569,Unbekannt,KKBucherMappenvor1800,,Buch,1511
2025838,Sign. B 110,Nicolas Gueudeville: Atlas historique ... Honoré: Amsterdam 1705,Unbekannt,KKBucherMappenvor1800,,Buch,1705
2022226,Sign. B 112,Gérard Audran: Des Menschlichen Lebes Proportionen ... Sandrart: [Nürnberg] [1686],Unbekannt,KKBucherMappenvor1800,,Buch,
2024663,Sign. B 115,Daniel Berger (nach Chodowiecki): Kl. zu Tristam Schandis: Leben und Meynungen. Hanau u. Höchst: Berlin 1776,Unbekannt,KKBucherMappenvor1800,,Buch,1776
2022534,Sign. B 120,Martin Luther (Übersetzer): Biblia. Das ist die gantze Heilige Schrifft Alten und Neuen Testaments. Wust: Wittenberg 1665,Unbekannt,KKBucherMappenvor1800,,Buch,1665
2022102,Sign. B 122,Martin Luther: Biblia (Sternsche Bilderbibel). Stern: Lüneburg 1672,"Luther, Martin",KKBucherMappenvor1800,,Buch,1672
2024684,Sign. B 124,"Matthäus Merian, Martin Luther: Biblia. Das ist die ganze Heilige Schrift Alten u Neuen Testaments. Ph. Andrea: Frankfurt / Main 1710",Unbekannt,KKBucherMappenvor1800,,Buch,1710
2025836,Sign. B 125,Biblia. Das ist: die gantze Heilige Schrifft des Alten und Neuen Testaments. Cotta: Tübingen 1729,"Luther, Martin",KKBucherMappenvor1800,,Buch,1729
2025098,Sign. B 128,"Biblia, Das ist: die gantze Heilige Schrifft des Alten und Neuen Testaments. Endt: Nürnberg 1755","Luther, Martin",KKBucherMappenvor1800,,Buch,1755
2025099,Sign. B 128 (2. Ex.),"Biblia, Das ist: die gantze Heilige Schrifft des Alten und Neuen Testaments. Endt: Nürnberg 1755","Luther, Martin",KKBucherMappenvor1800,,Buch,1755
2025101,Sign. B 130,Biblia. Das ist: die gantze Heilige Schrifft des Alten und Neuen Testaments. Endt: Nürnberg 1768,"Luther, Martin",KKBucherMappenvor1800,,Buch,1768
2039893,Sign. B 135,Henri Joseph van Blarenberghe (Zeichner): [Frz. Cavalerie Exercitien] [Frankreich]  o.O 1775,Unbekannt,KKBucherMappenvor1800,,Buch,
2023435,Sign. B 140,"Blaeu, Joan: Novus Atlas, das ist - Weldbeschreibung. [Amsterdam] [1655] "";"" T. 6",Unbekannt,KKBucherMappenvor1800,,Buch,
2024716,Sign. B 142,"Versuch den Ursprung der Spielkarten, die Einführung des leinenpapiers und den Anfang der Holzschneidekunst in Europa zu erforschen. Breitkopf: Leipzig 1784","Breitkopf, Johann Gottlob Immanuel",KKBucherMappenvor1800,,Buch,1784
2024043,Sign. B 143,"Jacob Bruckner: Ehrentempel der Deutschen Gelehrsamkeit, ...Männer unter den Deutschen aus dem 15., 16., 17. Jh. Jacob Haid: Augsburg 1747",Unbekannt,KKBucherMappenvor1800,,Buch,1747
2023919,Sign. B 145,"Vincencio Carducho, Fernandez (Rad.), Lopez (Rad.): Dialogos de la pintura su defenza, origen ... Madrid 1634",Unbekannt,KKBucherMappenvor1800,,Buch,1634
2023705,Sign. B 147,Jacob Cats: Hovwelyck. Dat is - De gantsche gheleghenheydt des Echten-Staets. Hans Passchiers van Wesbusch: Haarlem 1642,Unbekannt,KKBucherMappenvor1800,,Buch,1642
1964563,Sign. B 15,Biblia das ist die gantze Heilige Schrifft Deudsch. Lehmann: Wittenberg 1594,"Luther, Martin",KKBucherMappenvor1800,,Buch,1594
2037714,Sign. B 150,Miguel Cervantes: Estampes de l'histoire de Don Quichot de la Manche. Surugue: Paris 1753,Unbekannt,KKBucherMappenvor1800,,Buch,1753
2037876,Sign. B 155,"T. Cheesmann (Zeichner, Stecher): Six Heads. T. Cheesmann:  [London] 1792",Unbekannt,KKBucherMappenvor1800,,Buch,1792
2023483,Sign. B 157 / 10,"Manolriano Collaert: Florilegium. o. O. o. J.  [Antwerpen Ende 16., Anfang 17. Jh.]",Unbekannt,KKBucherMappenvor1800,,Buch,
2024392,Sign. B 160,"Repraesentatio Belli, ob successionem in Regno Hispanico ... gesti ... Der Spanische Successions-Krieg ... davon die ... Belagerungen, Bataillen ... in 56 ... mit curieusen Einfassungen^BF gezierte^BF Kupffer Blatten samt ... Beschreibungen ... vorgestellt worden auf Unkosten und Verlag Jeremias Wolffens Kunsthändlers seel: Erben, in Augspurg.","Wolff, Jeremias",KKBucherMappenvor1800,,Buch,um 1714/24 (?)
2025068,"Sign. B 161, 2",Paul Decker: Ausführliche Anleitung zur Civilbaukunst. o. O. (?) 1730,Unbekannt,KKBucherMappenvor1800,,Buch,1730
2025066,"Sign. B 161,1",Johann Jacob Schuebler: Perspectiva. Weigel: Nürnberg 1719,Unbekannt,KKBucherMappenvor1800,,Buch,1720
2023309,Sign. B 165,"Sebastien Depontault: Les glorieuses conquestes de Louis Le Grand, Roy de France et de Navarre"";"" ... Tom.1.2. Beaulieu: Paris 1676",Unbekannt,KKBucherMappenvor1800,,Buch,1676
1960134,Sign. B 17,Biblia cum summarior ...  O. O. [um 1560],Unbekannt,KKBucherMappenvor1800,,Buch,
2025886,Sign. B 170,M. Desgodetz: Les édifices antiques de Rome ... Jombert: Paris 1779,Unbekannt,KKBucherMappenvor1800,,Buch,1779
2022132,Sign. B 175,Wendel Dietterlein: Architectura. Paulus Fürst: Nürnberg 1655,Unbekannt,KKBucherMappenvor1800,,Buch,
2023317,Sign. B 184,André Felibien (Hg.): Statues et Bustes antiques des Maisons royales. Paris 1679,Unbekannt,KKBucherMappenvor1800,,Buch,1679
2025152,"Sign. B 185, 1",Pietro Ferrerio: Palazzi di Roma de più celebri architetti designati da P. Ferrerio. Rom o. J.,Unbekannt,KKBucherMappenvor1800,,Buch,
2022722,"Sign. B 185, 2",Gio Battista Falda: Nuovi designi delle architectture e piante de´palazzi di Roma. o. O.  o. J.,Unbekannt,KKBucherMappenvor1800,,Buch,
2032575,Sign. B 187,[Ferriol]: Recueil de cent estampes ... Paris 1714 / 1715,Unbekannt,KKBucherMappenvor1800,,Buch,1714
2029816,Sign. B 190,"Fischer von Erlach, Johann Bernhard: Entwurff einer historischen Architectur in Abbildung unterschiedener berühmter Gebäude des Alterthums und fremder Völcker ... Wien 1721",Unbekannt,KKBucherMappenvor1800,,Buch,1721
2027068,Sign. B 193,Fulvio Fontana: I Pregi della Toscana ... Miccioni: Florenz 1701,Unbekannt,KKBucherMappenvor1800,,Buch,1701
2025064,Sign. B 195,Joseph Fratrel: Oeuvre de Joseph Fratrel peintre de la cour ... Mannheim 1799,Unbekannt,KKBucherMappenvor1800,,Buch,1799
2022224,Sign. B 195/10,Paul Freher: Theatrum virorum eruditione clarorum ... Hofmanni: Nürnberg 1688,Unbekannt,KKBucherMappenvor1800,,Buch,1688
2026258,Sign. B 195/20,Joseph Furrtenbach: Manhaffter Kunst-Spiegel oder Entwerffung der Löb. Haupt Statt in Liguria ... Augsburg 1663,Unbekannt,KKBucherMappenvor1800,,Buch,1663
2032552,Sign. B 196,Pierre Joseph Garidel: Histoire des plantes ... David: Aix 1715,Unbekannt,KKBucherMappenvor1800,,Buch,1715
2032562,Sign. B 197,A. E. Gautier d'Agoty: Cours complet d'Anatomie. Leclerc: Nancy 1773,Unbekannt,KKBucherMappenvor1800,,Buch,1773
2021434,"Sign. B 198,1",Georg II. Landgraf von Hessen Darmstadt: [Leichenpredigten]. [Darmstadt 1662],Unbekannt,KKBucherMappenvor1800,,Buch,1662
2021435,"Sign. B 198,2","Petrus Haberkornius: Programmata et orationes publicae, habitae in academia Gissena. o.O. (?) o. J.",Unbekannt,KKBucherMappenvor1800,,Buch,
2031990,Sign. B 199/10,Oevres de Salomon Gessner.  Selbstverlag 1777 und 1778,Unbekannt,KKBucherMappenvor1800,,Buch,
2023738,Sign. B 20,Phillipp Cluverius: Germania antiqua. Libri tres ... Elzevir: Leiden/Leyden 1616,Unbekannt,KKBucherMappenvor1800,,Buch,1616
2022815,Sign. B 200,Fabio Glissenti: Discorsi Morali dell fabio Glissenti contra il dispiacer del morire. Detto Athanatophilia ... Alberti: Venedig 1609,Unbekannt,KKBucherMappenvor1800,,Buch,1609
2030645,Sign. B 203,[Johann Wolfgang Goethe]: Das Römische Carneval. Unger: Weimar u. Gotha 1789 [als Neudruck durch: Drugulin: Leipzig 1905],Unbekannt,KKBucherMappenvor1800,,Buch,1789 / 1905
2021736,Sign. B 205,"Joh. Ludov. Gottfridus (d.i. Joh. Philipp Obelin): Historische Chronica oder Beschreibung der fürnehmsten Geschichten, die sich von Anfang der Welt biss auf das Jahr 1619 zugetragen ... Merian: Frankfurt 1671",Unbekannt,KKBucherMappenvor1800,,Buch,1671
2032579,Sign. B 210,"Jean Joseph Granet, Cochin (Stecher): Histoire de l'Hotel Royal des Invalides ... Desprez: Paris 1736",Unbekannt,KKBucherMappenvor1800,,Buch,1736
2037749,Sign. B 214,"J. Hawkesworth: Relation des Voyages entrepris par ordre de Sa Majeste Brittanique ... Saillant et Nyon, Panckouke: Paris 1774",Unbekannt,KKBucherMappenvor1800,,Buch,1774
2025894,Sign. B 218,"Hoet: Taferelen der voornaamste Geschiedenissen van het oude et nieuwe testament ... Houdt: Den Haag 1728 "";"" 2bändig",Unbekannt,KKBucherMappenvor1800,,Buch,1728
2037875,Sign. B 220,nach Hans Holbein: Imitations of original drawings by Hans Holbein ... persons of court of Henry III. John Clamberlaine: London 1792,Unbekannt,KKBucherMappenvor1800,,Buch,1792
2037861,Sign. B 225,Romeyn de Hooghe (Verf.) : Hieroglyphica oder Denkbilder der alten Völker ... Arkstee: Amsterdam 1744,Unbekannt,KKBucherMappenvor1800,,Buch,1744
2022105,Sign. B 230,Melchior Küsell I (nach Zeichn. von Wilhelm Baur): Darstellungen aus dem Leben Christi. München 1671 (?),Unbekannt,KKBucherMappenvor1800,,Buch,
2023869,Sign. B 235,Jean Michel le jeune Moreau (Stecher): Historiettes ou nouvelles en vers. Amsterdam 1774,Unbekannt,KKBucherMappenvor1800,,Buch,1774
1960448,Sign. B 25,"Concordia - Christliche, widerholete, einmütige bekentnüs nach benanter Churfürsten, Fürsten und  und Stende Augspurgischer Konfession. Dresden 1580",Unbekannt,KKBucherMappenvor1800,,Buch,
2021436,Sign. B 250,Adolph von Kamp: [Beschreibung der Begrebnus ... des Herrn Herrn Johan Wilhelm Hertzogen zu Gulich Clewe und Berg ...] Düsseldorf (?) 1628,Unbekannt,KKBucherMappenvor1800,,Buch,1628
2037865,Sign. B 251,nach Salomon Kleiner: Bauten und Tore eines kaiserlichen Schlosses auf dem Wege nach Ungarn. o. O.  o. J. [18. Jh.],Unbekannt,KKBucherMappenvor1800,,Buch,
2037873,Sign. B 255,"W. G. Knorrr: Deliciae naturae selectae, of uitgeleezen Kabinet van natuurlyke zeldsaamheden ... Blussé en Zoon: Dordrecht 1771",Unbekannt,KKBucherMappenvor1800,,Buch,1771
2023455,Sign. B 260,Raimond Lafage: Recueil des meilleurs desseins de R. Lafage. Valck: Amsterdam o. J.,Unbekannt,KKBucherMappenvor1800,,Buch,
2037699,Sign. B 262,"P. C. Lafargue: Convoi-Funebre de son altesse royale Anne, Princessin Royale de la Grand Bretagne ... Gosse: Haye 1761",Unbekannt,KKBucherMappenvor1800,,Buch,1761
2023740,Sign. B 264-I,"Larray, de: Histoire d `ecosse, et d`Irlande. ... (Tom 1.2). Leers: Rotterdam 1697",Unbekannt,KKBucherMappenvor1800,,Buch,1697
2029317,Sign. B 264-II,"Larray, de: Histoire d `ecosse, et d`Irlande. ... (Tom 1.2). Leers: Rotterdam 1698",Unbekannt,KKBucherMappenvor1800,,Buch,1698
2037759,Sign. B 265,C. Lebrun: Batailles d´Alexandre-le-Grand. Lamy: Paris 1784,Unbekannt,KKBucherMappenvor1800,,Buch,1784
2024671,Sign. B 265 / 70,"Samuel Lentz: Historisch-Genealogische Fürstellung des Hochfürstlichen Hauses Anhalt und der davon abstammenden Markgrafen zu Brandenburg, Herzoge zu sachsen und Sachsen-Lauenburg. Cörner: Cöthen, Dessau 1757",Unbekannt,KKBucherMappenvor1800,,Buch,1757
2037757,Sign. B 265/60,M. Leonard: Le Temple de Gnide. Merigot: Paris 1776,Unbekannt,KKBucherMappenvor1800,,Buch,1776
2037879,Sign. B 266,"Jean-Bapt. Le Prince: Oevre de J. B. Le Prince. o. V., o.O.,  o. D.    [J. Model: Berlin 1796]",Unbekannt,KKBucherMappenvor1800,,Buch,
2021019,"Sign. B 268,1","Georg Engelhard von Loehneyss: Della Cavalleria ... Remlingen 1624 ""; (Hg.: Heinrich Julius u Wolff Ernst Loehneyess;"" Vorrede v Michael Bötnerus)",Unbekannt,KKBucherMappenvor1800,,Buch,1624
