ID,IdentNr,Titel,Beteiligte,Bereich,MatTech,Objekttyp,Datierung
2353910,18201069,"Schleicher, Julia: Unkraut vergeht nicht",,MKMedaillen20Jhbisheute1900bisheute,"Bronze, gegossen",Numismatik,2014
2354427,18201615,"Fitzenreiter, Wilfried: Griechische Münzprägung",,MKMedaillen20Jhbisheute1900bisheute,"Bronze, gegossen",Numismatik,1978
2354428,18201619,"Jesus, Fernando: Iberoamerikanische Ausstellung 1958",,MKMedaillen20Jhbisheute1900bisheute,"Bronze, geprägt, 12",Numismatik,1958
2354929,18202222,"Wrba, Georg: Alfred Messel",,MKMedaillen20Jhbisheute1900bisheute,"Bronze, geprägt",Numismatik,1905
2355965,18203457,"Gies, Ludwig: Bruno Paul",,MKMedaillen20Jhbisheute1900bisheute,"Porzellan, modelliert",Numismatik,1954
2355966,18203458,"Pilgrim, Hubertus von: Demonstranten 1989",,MKMedaillen20Jhbisheute1900bisheute,"Bronze, gegossen",Numismatik,1990
2356052,18203560,"Pilgrim, Hubertus von: Phönix",,MKMedaillen20Jhbisheute1900bisheute,"Bronze, gegossen",Numismatik,1991
2357809,18205498,"Kowarzik, Joseph: Theodor Mommsen",,MKMedaillen20Jhbisheute1900bisheute,"Bronze, gegossen",Numismatik,1903
2357812,18205501,"Bosselt, Rudolf: Julius Menadier",,MKMedaillen20Jhbisheute1900bisheute,"Bronze, gegossen",Numismatik,1929
2357813,18205502,"Morin, Georges: James Simon",,MKMedaillen20Jhbisheute1900bisheute,"Bronze, gegossen",Numismatik,1912
2357816,18205505,"Kolbe, Georg: Adolf von Harnack",,MKMedaillen20Jhbisheute1900bisheute,"Bronze, gegossen",Numismatik,um 1926
2357817,18205506,"Elkan, Benno: Friedrich Ebert",,MKMedaillen20Jhbisheute1900bisheute,"Bronze, gegossen",Numismatik,1925
2357818,18205507,"Fürst, Else: Helene Lange",,MKMedaillen20Jhbisheute1900bisheute,"Bronze, gegossen",Numismatik,1916
2357819,18205508,"Bosselt, Rudolf: Peter Behrens",,MKMedaillen20Jhbisheute1900bisheute,"Bronze, gegossen",Numismatik,1918
2357821,18205510,"Kaufmann, Hugo: Max Liebermann",,MKMedaillen20Jhbisheute1900bisheute,"Bronze, geprägt",Numismatik,1905
2357822,18205511,"Gies, Ludwig: Selbstbildnis",,MKMedaillen20Jhbisheute1900bisheute,"Biskuitporzellan, modelliert",Numismatik,1930
2357824,18205513,"Gies, Ludwig: Kruzifix in Kirchenruine",,MKMedaillen20Jhbisheute1900bisheute,"Eisen, gegossen",Numismatik,1917
2357825,18205514,"Gies, Ludwig: Vertrieben",,MKMedaillen20Jhbisheute1900bisheute,"Bronze, gegossen",Numismatik,1915
2357829,18205518,"Gies, Ludwig: Amerika im Weltkrieg",,MKMedaillen20Jhbisheute1900bisheute,"Bronze, gegossen",Numismatik,1917
2357830,18205519,"Gies, Ludwig: Das neue Chaos",,MKMedaillen20Jhbisheute1900bisheute,"Bronze, gegossen",Numismatik,1917
2357831,18205520,"Gies, Ludwig: Ruhrkampf",,MKMedaillen20Jhbisheute1900bisheute,"Eisen, gegossen",Numismatik,1923
2357832,18205521,"Gies, Ludwig: Athena in den Trümmern",,MKMedaillen20Jhbisheute1900bisheute,"Silber, gegossen",Numismatik,1947
2357833,18205522,"Broer, Hilde: Christus auf den Wogen",,MKMedaillen20Jhbisheute1900bisheute,"Bronze, gegossen",Numismatik,1967
2357834,18205523,"Broer, Hilde: Christi Geburt",,MKMedaillen20Jhbisheute1900bisheute,"Bronze, gegossen",Numismatik,1970
2357835,18205524,"Broer, Hilde: Jonas",,MKMedaillen20Jhbisheute1900bisheute,"Bronze, gegossen",Numismatik,1971
2357836,18205525,"Broer, Hilde: Daphne II",,MKMedaillen20Jhbisheute1900bisheute,"Bronze, gegossen",Numismatik,1970
2357837,18205526,"Broer, Hilde: Menschen und Engel",,MKMedaillen20Jhbisheute1900bisheute,"Bronze, gegossen",Numismatik,1968
2357838,18205527,"Broer, Hilde: Ostern (Passion)",,MKMedaillen20Jhbisheute1900bisheute,"Bronze, gegossen",Numismatik,1967
2357857,18205546,"Galtie, Andre: FIDEM Paris 1957",,MKMedaillen20Jhbisheute1900bisheute,"Bronze, gegossen",Numismatik,1957
2357858,18205547,"Welz, Ferdinand: FIDEM Wien 1959",,MKMedaillen20Jhbisheute1900bisheute,"Bronze, gegossen",Numismatik,1959
2357859,18205548,"Asselbergs, Jean: FIDEM Paris 1967",,MKMedaillen20Jhbisheute1900bisheute,"Bronze, geprägt",Numismatik,1967
2357861,18205550,"Lacko, Karol: FIDEM Prag 1969",,MKMedaillen20Jhbisheute1900bisheute,"Bronze, gegossen",Numismatik,1969
2357862,18205551,"Stuhlmüller, Friedrich: FIDEM Köln 1971",,MKMedaillen20Jhbisheute1900bisheute,"Bronze, gegossen",Numismatik,1971
2357863,18205552,"Juva, Kari: FIDEM Helsinki 1973",,MKMedaillen20Jhbisheute1900bisheute,"Bronze, gegossen",Numismatik,1973
2357864,18205553,"Nowakowski, Jerzy: FIDEM Krakau 1975",,MKMedaillen20Jhbisheute1900bisheute,"Bronze, gegossen",Numismatik,1975
2357865,18205554,"Papp, Lazlo: FIDEM Budapest 1977",,MKMedaillen20Jhbisheute1900bisheute,"Bronze, gegossen",Numismatik,1977
2357866,18205555,"Vivarelli, Jorio: FIDEM Florenz 1983",,MKMedaillen20Jhbisheute1900bisheute,"Bronze, gegossen",Numismatik,1983
2357867,18205556,"Helleberg, Berndt: FIDEM Stockholm 1985",,MKMedaillen20Jhbisheute1900bisheute,"Bronze, gegossen",Numismatik,1985
2357868,18205557,"Kaufman, Mico: FIDEM Colorado Springs 1987",,MKMedaillen20Jhbisheute1900bisheute,"Bronze, gegossen",Numismatik,1987
2357869,18205558,"Räsänen, Kauko: Helsiniki 1990",,MKMedaillen20Jhbisheute1900bisheute,"Bronze, gegossen, 12",Numismatik,1990
2357870,18205559,"Searle, Ronald: FIDEM London 1992",,MKMedaillen20Jhbisheute1900bisheute,"Bronze, geprägt",Numismatik,1992
2357871,18205560,"Tornay, Endre Andras: FIDEM Budapest 1994",,MKMedaillen20Jhbisheute1900bisheute,"Bronze, gegossen",Numismatik,1994
2357872,18205561,"Godec, Werner: FIDEM Neuchatel 1996",,MKMedaillen20Jhbisheute1900bisheute,"Bronze, geprägt",Numismatik,1996
2357873,18205562,"Mieras, Mirjam: FIDEM Den Haag 1998",,MKMedaillen20Jhbisheute1900bisheute,Aluminium,Numismatik,1998
2357874,18205563,"Klöde-Hoffmann, Silvia: FIDEM Weimar 2000",,MKMedaillen20Jhbisheute1900bisheute,"Silber, 12, geprägt",Numismatik,2000
2357875,18205564,"Boquoy, Gerard: FIDEM Paris 2002",,MKMedaillen20Jhbisheute1900bisheute,"Bronze, 12, geprägt",Numismatik,2002
2357876,18205565,"Schütz, Siegmund: Europa",,MKMedaillen20Jhbisheute1900bisheute,"Bronze, gegossen",Numismatik,1996
2357877,18205566,"Fitzenreiter, Wilfried: Sammlers Liebling",,MKMedaillen20Jhbisheute1900bisheute,"Bronze, gegossen",Numismatik,1996
2357878,18205567,"Fitzenreiter, Wilfried: Sammlers Liebling",,MKMedaillen20Jhbisheute1900bisheute,"Bronze, gegossen",Numismatik,1996
2357879,18205568,"Theumer, Carsten: Kein Parisurteil",,MKMedaillen20Jhbisheute1900bisheute,"Bronze, gegossen",Numismatik,1997
2357880,18205569,"Auer, Horst: Weltmodell",,MKMedaillen20Jhbisheute1900bisheute,"Bronze, gegossen",Numismatik,1997
2357881,18205570,"Schwarzbach, Anna Franziska: Medaillenwahl",,MKMedaillen20Jhbisheute1900bisheute,"Bronze, gegossen",Numismatik,1998
2357882,18205571,"Dobberkau, Heide: Verlorene Freiheit",,MKMedaillen20Jhbisheute1900bisheute,"Bronze, gegossen",Numismatik,1999
2357883,18205572,"Güttler, Peter-Götz: Paulskirche Frankfurt",,MKMedaillen20Jhbisheute1900bisheute,"Weißmetall, gegossen",Numismatik,1999
2357884,18205573,"Klöde-Hoffmann, Silvia: Janus (FIDEM Weimar 2000)",,MKMedaillen20Jhbisheute1900bisheute,"Böttgersteinzeug, 6, geprägt",Numismatik,2000
2357886,18205574,"Güttler, Peter-Götz: 10 Jahre DGMK",,MKMedaillen20Jhbisheute1900bisheute,"Weißmetall, gegossen",Numismatik,2001
2357887,18205575,"Güttler, Peter-Götz: 10 Jahre DGMK",,MKMedaillen20Jhbisheute1900bisheute,"Bronze, geprägt",Numismatik,2001
2357888,18205576,"Zobl, Helmut: Glückliche Verkettung",,MKMedaillen20Jhbisheute1900bisheute,"Silber, geprägt",Numismatik,2003
2357889,18205577,"Klöde-Hoffmann, Silvia: Pax Optima Rerum",,MKMedaillen20Jhbisheute1900bisheute,"Böttgersteinzeug, 12, geprägt",Numismatik,2005
2357890,18205578,"Stoy, Olaf: Dresden",,MKMedaillen20Jhbisheute1900bisheute,"Porzellan, modelliert",Numismatik,2005
2357903,18205591,"Kounitzky, Franz: Richard Strauss",,MKMedaillen20Jhbisheute1900bisheute,"Bronze, gegossen",Numismatik,1906
2357907,18205595,"Sturm, Paul: Gruß aus der Königlichen Münze Berlin",,MKMedaillen20Jhbisheute1900bisheute,"Eisen, geprägt",Numismatik,1909
2357909,18205597,"Breuer, Peter: Preismedaille für musikalische Verdienste",,MKMedaillen20Jhbisheute1900bisheute,"Bronze, geprägt",Numismatik,1906
2357910,18205598,"Kowarzik, Joseph: 50 Jahre Deutsche Continental-Gas-Gesellschaft",,MKMedaillen20Jhbisheute1900bisheute,"Bronze, gegossen",Numismatik,um 1905
2357911,18205599,"Sturm, Paul: Richard Wagner",,MKMedaillen20Jhbisheute1900bisheute,"Bronze, gegossen",Numismatik,1904
2357912,18205600,"Kraumann, Alexander: 300 Jahre Heilquelle Salzbrunn",,MKMedaillen20Jhbisheute1900bisheute,"Bronze, gegossen",Numismatik,1901
2357913,18205601,"Sturm, Paul: Gesellschaft für Anthropologie",,MKMedaillen20Jhbisheute1900bisheute,"Silber, geprägt",Numismatik,1909
2357914,18205602,"Morin, Georges: Lebensalter",,MKMedaillen20Jhbisheute1900bisheute,"Bronze, gegossen",Numismatik,um 1908
2357915,18205603,"Starck, Constantin: Jahrhundertwende",,MKMedaillen20Jhbisheute1900bisheute,"Silber, gegossen",Numismatik,1900
2357916,18205604,"Starck, Constantin: Jahrhundertwende",,MKMedaillen20Jhbisheute1900bisheute,"Silber, geprägt",Numismatik,1900
2357919,18205607,"Sturm, Paul: Mädchen beim Betrachten einer Medaille",,MKMedaillen20Jhbisheute1900bisheute,"Stein, geschnitten",Numismatik,um 1903
2357920,18205608,"Sturm, Paul: Georg Treu",,MKMedaillen20Jhbisheute1900bisheute,"Bronze, gegossen",Numismatik,um 1903
2357921,18205609,"Weidanz, Gustav: Schülermedaille der Unterrichtsanstalt des Kunstgewerbemuseums",,MKMedaillen20Jhbisheute1900bisheute,"Bronze, gegossen",Numismatik,1912
2357922,18205610,"Bosselt, Rudolf: Weltausstellung Brüssel 1910",,MKMedaillen20Jhbisheute1900bisheute,"Bronze, geprägt",Numismatik,1910
2357923,18205611,"Gies, Ludwig: Erdbeben",,MKMedaillen20Jhbisheute1900bisheute,"Bronze, gegossen",Numismatik,1912
2357924,18205612,"Klinger, Max: 50 Jahre Deutscher Handelstag",,MKMedaillen20Jhbisheute1900bisheute,"Bronze, gegossen",Numismatik,1911
2357928,18205616,"Fitzenreiter, Wilfried: Teilnehmermedaille XII. INK",,MKMedaillen20Jhbisheute1900bisheute,"Gips, gegossen",Numismatik,1997
2357929,18205617,"Fitzenreiter, Wilfried: Teilnehmermedaille XII. INK",,MKMedaillen20Jhbisheute1900bisheute,"Eisen, geprägt",Numismatik,1997
2357930,18205618,"Fitzenreiter, Wilfried: Teilnehmermedaille XII. INK",,MKMedaillen20Jhbisheute1900bisheute,"Eisen, geprägt",Numismatik,1997
2357931,18205619,"Fitzenreiter, Wilfried: Teilnehmermedaille XII. INK",,MKMedaillen20Jhbisheute1900bisheute,"Bronze, 12, geprägt",Numismatik,1997
2357932,18205620,"Fitzenreiter, Wilfried: Teilnehmermedaille XII. INK",,MKMedaillen20Jhbisheute1900bisheute,"Bronze, 12, geprägt",Numismatik,1997
2357933,18205621,"Güttler, Peter-Götz: Ehrenmedaille XII. INK",,MKMedaillen20Jhbisheute1900bisheute,"Weißmetall, gegossen",Numismatik,1997
2357934,18205622,"Güttler, Peter-Götz: Ehrenmedaille XII. INK",,MKMedaillen20Jhbisheute1900bisheute,"Weißmetall, gegossen",Numismatik,1997
2357935,18205623,"Klöde-Hoffmann, Silvia: FIDEM Weimar 2000",,MKMedaillen20Jhbisheute1900bisheute,"Silber, 12, geprägt",Numismatik,2000
2357937,18205625,"Klöde-Hoffmann, Silvia: FIDEM Weimar 2000 (Probe)",,MKMedaillen20Jhbisheute1900bisheute,"Bronze, 12, geprägt",Numismatik,2000
2357938,18205626,"Linke, Eberhard: Ehrenmedaille FIDEM Weimar 2000",,MKMedaillen20Jhbisheute1900bisheute,"Terrakotta, modelliert",Numismatik,2000
2357939,18205627,"Linke, Eberhard: Ehrenmedaille FIDEM Weimar 2000",,MKMedaillen20Jhbisheute1900bisheute,"Terrakotta, modelliert",Numismatik,2000
2359102,18206900,"Heinsdorff, Reinhart: Neubeginn",,MKMedaillen20Jhbisheute1900bisheute,"Bronze, gegossen",Numismatik,1991
2359151,18206950,"Henke, Johannes: Wenn der Damm bricht",,MKMedaillen20Jhbisheute1900bisheute,"Bronze, gegossen",Numismatik,1989
2359178,18206979,"Ott, Erich: Deutschland 89/90",,MKMedaillen20Jhbisheute1900bisheute,"Bronze, gegossen",Numismatik,1990
2359179,18206980,"Henke, Johannes: 13.8.1961",,MKMedaillen20Jhbisheute1900bisheute,"Bronze, gegossen",Numismatik,1961
2359180,18206981,"Henke, Johannes: Aufruhr",,MKMedaillen20Jhbisheute1900bisheute,"Bronze, gegossen",Numismatik,1989
2359223,18207027,"Uhlmann, Waldemar und Otto Schultz: Preismedaille 1900",,MKMedaillen20Jhbisheute1900bisheute,"Silber, 12, geprägt",Numismatik,1900
2359224,18207029,Preismedaille 1914,,MKMedaillen20Jhbisheute1900bisheute,"Bronze, gegossen",Numismatik,1914
2359226,18207031,"Sutkowski, Walter: Preismedaille 1919",,MKMedaillen20Jhbisheute1900bisheute,"Bronze, gegossen",Numismatik,1919
2359239,18207044,"Schollmeyer, Catharina: Preismedaille 1919",,MKMedaillen20Jhbisheute1900bisheute,"Bronze, gegossen",Numismatik,1919
2359240,18207045,"Wolters, Hildegard: Preismedaille 1926",,MKMedaillen20Jhbisheute1900bisheute,"Bronze, gegossen",Numismatik,1926
2359241,18207046,Preismedaille 1930,,MKMedaillen20Jhbisheute1900bisheute,"Bronze, gegossen",Numismatik,1930
2359242,18207047,"Blazek, Franz: 100 Jahre Stiftung des Eisernen Kreuzes",,MKMedaillen20Jhbisheute1900bisheute,"Eisen, gegossen",Numismatik,1913
2359264,18207069,"Althans, Hedwig: Preismedaille 1931",,MKMedaillen20Jhbisheute1900bisheute,"Bronze, gegossen",Numismatik,1931
2359265,18207070,"Avenhaus, Werner: Preismedaille 1930",,MKMedaillen20Jhbisheute1900bisheute,"Bronze, gegossen",Numismatik,1930
2359270,18207075,100. Jahrestag der Befreiungskriege,,MKMedaillen20Jhbisheute1900bisheute,"Eisen, gegossen",Numismatik,1913
2359292,18207096,"Merling, Paul: 25-jähriges Dienstjubiläum Prof. Körte",,MKMedaillen20Jhbisheute1900bisheute,"Bronze, gegossen",Numismatik,1925
2359293,18207097,"Bechteler, Theo: Preismedaille im Fechtwettkampf",,MKMedaillen20Jhbisheute1900bisheute,"Bronze, gegossen",Numismatik,um 1930
2359335,18207140,"Georgii, Theodor: Adolf von Hildebrand",,MKMedaillen20Jhbisheute1900bisheute,"Bronze, 11, geprägt",Numismatik,1917
2359522,18207354,"Kempe-Hertzberg, Margot: Preismedaille 1925",,MKMedaillen20Jhbisheute1900bisheute,"Bronze, gegossen",Numismatik,1925
2359523,18207355,Preismedaille 1927/1928?,,MKMedaillen20Jhbisheute1900bisheute,"Bronze, gegossen",Numismatik,1927/1928?
2359524,18207356,Preismedaille 1928,,MKMedaillen20Jhbisheute1900bisheute,"Bronze, gegossen",Numismatik,1928
2359525,18207357,"Weidanz, Gustav: 25-jähriges Dienstjubiläum Prof. Ernst Küpers",,MKMedaillen20Jhbisheute1900bisheute,"Bronze, gegossen",Numismatik,1914
2359531,18207421,"Weidanz, Gustav: Ministermedaille 1921",,MKMedaillen20Jhbisheute1900bisheute,"Bronze, gegossen",Numismatik,1921
2359912,18207874,"Burgeff, Hans Karl: Mondmann I",,MKMedaillen20Jhbisheute1900bisheute,"Bronze, gegossen",Numismatik,1952
2359915,18207877,"Burgeff, Hans Karl: Grete Burgeff-Devrient auf dem Totenbett",,MKMedaillen20Jhbisheute1900bisheute,"Bronze, gegossen",Numismatik,1953
2359918,18207880,"Burgeff, Hans Karl: Karl Marbe",,MKMedaillen20Jhbisheute1900bisheute,"Bronze, gegossen",Numismatik,1953
2359919,18207881,"Burgeff, Hans Karl: Rudolf Peer",,MKMedaillen20Jhbisheute1900bisheute,"Bronze, gegossen",Numismatik,1954
2359920,18207882,"Burgeff, Hans Karl: Carl Friedrich Zelter",,MKMedaillen20Jhbisheute1900bisheute,"Bronze, gegossen",Numismatik,1954
2359921,18207883,"Burgeff, Hans Karl: Mondmann II",,MKMedaillen20Jhbisheute1900bisheute,"Bronze, gegossen",Numismatik,1956
2359922,18207884,"Burgeff, Hans Karl: Träumende",,MKMedaillen20Jhbisheute1900bisheute,"Bronze, gegossen",Numismatik,1956
2359923,18207886,"Burgeff, Hans Karl: Zeichnender",,MKMedaillen20Jhbisheute1900bisheute,"Bronze, gegossen",Numismatik,1956
2359924,18207887,"Burgeff, Hans Karl: Georg Sticker",,MKMedaillen20Jhbisheute1900bisheute,"Bronze, gegossen",Numismatik,1957
2359925,18207889,"Burgeff, Hans Karl: Jonas II",,MKMedaillen20Jhbisheute1900bisheute,"Bronze, gegossen",Numismatik,1958
2359926,18207892,"Burgeff, Hans Karl: Buch haltende Hände",,MKMedaillen20Jhbisheute1900bisheute,"Bronze, gegossen",Numismatik,1958
2359927,18207893,"Burgeff, Hans Karl: Weihnachten I",,MKMedaillen20Jhbisheute1900bisheute,"Terrakotta, modelliert",Numismatik,1960
2359928,18207895,"Burgeff, Hans Karl: Max Nonne",,MKMedaillen20Jhbisheute1900bisheute,"Bronze, gegossen",Numismatik,1961
2359929,18207896,"Burgeff, Hans Karl: Abreise",,MKMedaillen20Jhbisheute1900bisheute,"Bronze, gegossen",Numismatik,1962
2359930,18207898,"Burgeff, Hans Karl: Hochzeitsplakette",,MKMedaillen20Jhbisheute1900bisheute,"Bronze, gegossen",Numismatik,1962
2359931,18207900,"Burgeff, Hans Karl: Ludwig Gies II",,MKMedaillen20Jhbisheute1900bisheute,"Bronze, gegossen",Numismatik,1963
2359932,18207902,"Burgeff, Hans Karl: Christophorus IV",,MKMedaillen20Jhbisheute1900bisheute,"Bronze, gegossen",Numismatik,1963
2359933,18207903,"Burgeff, Hans Karl: Fortuna",,MKMedaillen20Jhbisheute1900bisheute,"Silber, geprägt",Numismatik,um 1965
2359934,18207904,"Burgeff, Hans Karl: Otto Bongartz",,MKMedaillen20Jhbisheute1900bisheute,"Bronze, gegossen",Numismatik,1966
2359935,18207905,"Burgeff, Hans Karl: Everhard Jabach II",,MKMedaillen20Jhbisheute1900bisheute,"Bronze, gegossen",Numismatik,1966
2359936,18207906,"Burgeff, Hans Karl: Hermes im Götterflug",,MKMedaillen20Jhbisheute1900bisheute,"Bronze, gegossen",Numismatik,1968
2359937,18207907,"Burgeff, Hans Karl: Kallendresserorden",,MKMedaillen20Jhbisheute1900bisheute,"Bronze, gegossen",Numismatik,1968
2359938,18207908,"Burgeff, Hans Karl: Everhard Jabach IV",,MKMedaillen20Jhbisheute1900bisheute,"Bronze, geprägt",Numismatik,1966
2359939,18207909,"Burgeff, Hans Karl: Engel am Grab",,MKMedaillen20Jhbisheute1900bisheute,"Bronze, gegossen",Numismatik,1966
2359940,18207910,"Burgeff, Hans Karl: Johannes Gutenberg",,MKMedaillen20Jhbisheute1900bisheute,"Keramik, gegossen",Numismatik,1968
2359941,18207911,"Burgeff, Hans Karl: Vater I",,MKMedaillen20Jhbisheute1900bisheute,"Eisen, gegossen",Numismatik,1966
2359942,18207913,"Burgeff, Hans Karl: Hildegard Domizlaff",,MKMedaillen20Jhbisheute1900bisheute,"Bronze, gegossen",Numismatik,1967
2359943,18207914,"Burgeff, Hans Karl: Vater II",,MKMedaillen20Jhbisheute1900bisheute,"Bronze, gegossen",Numismatik,1967
2359944,18207915,"Burgeff, Hans Karl: Ostern",,MKMedaillen20Jhbisheute1900bisheute,"Terrakotta, modelliert",Numismatik,1967
2360008,18208001,"Burgeff, Hans Karl: Karnevalistische Trinität",,MKMedaillen20Jhbisheute1900bisheute,"Bronze, gegossen",Numismatik,1968
2360012,18208008,"Burgeff, Hans Karl: Hermes II",,MKMedaillen20Jhbisheute1900bisheute,"Bronze, gegossen",Numismatik,1968
2360016,18208012,"Burgeff, Hans Karl: Fußwaschung",,MKMedaillen20Jhbisheute1900bisheute,"Bronze, gegossen",Numismatik,1968
2360018,18208014,"Burgeff, Hans Karl: Eule",,MKMedaillen20Jhbisheute1900bisheute,"Silber, gegossen",Numismatik,1968
2360021,18208017,"Burgeff, Hans Karl: Lebensbaum",,MKMedaillen20Jhbisheute1900bisheute,"Silber, geprägt",Numismatik,1968
2360022,18208018,"Burgeff, Hans Karl: Pflanze des Herakles (Herakleum)",,MKMedaillen20Jhbisheute1900bisheute,"Silber, geprägt",Numismatik,1969
2360023,18208019,"Burgeff, Hans Karl: Albert Schweitzer",,MKMedaillen20Jhbisheute1900bisheute,"Bronze, gegossen",Numismatik,1969
2360025,18208021,"Burgeff, Hans Karl: Konrad Adenauer",,MKMedaillen20Jhbisheute1900bisheute,"Bronze, gegossen",Numismatik,1969
2360027,18208023,"Burgeff, Hans Karl: Narziß und Echo",,MKMedaillen20Jhbisheute1900bisheute,"Bronze, gegossen",Numismatik,1969
2360029,18208025,"Burgeff, Hans Karl: Albert Schweitzer Realschule Köln",,MKMedaillen20Jhbisheute1900bisheute,"Bronze, gegossen",Numismatik,1969
2360030,18208026,"Burgeff, Hans Karl: Karl Winnacker II",,MKMedaillen20Jhbisheute1900bisheute,"Bronze, gegossen",Numismatik,1969
2360121,18208125,"Dupré, Georges: Der Medailleur und die Medaillenkunst",,MKMedaillen20Jhbisheute1900bisheute,"Bronze, geprägt, 12",Numismatik,um 1900
2360136,18208140,"Sturm, Paul und Reinhard Kullrich: Auszeichnungsplakette",,MKMedaillen20Jhbisheute1900bisheute,"geprägt, Bronze, 12",Numismatik,1919
2360138,18208142,"Broschat, Bodo: 27. Internationale Münztechnikertagung in Berlin",,MKMedaillen20Jhbisheute1900bisheute,"Bronze, geprägt, 12",Numismatik,1997
2360145,18208149,"Burgeff, Hans Karl: Theodor Storm",,MKMedaillen20Jhbisheute1900bisheute,"Kupfer, geprägt",Numismatik,1969
2360149,18208153,"Burgeff, Hans Karl: Ernst Barlach",,MKMedaillen20Jhbisheute1900bisheute,"Eisen, gegossen",Numismatik,1970
2360153,18208157,"Burgeff, Hans Karl: Fritz Deutsch",,MKMedaillen20Jhbisheute1900bisheute,"Bronze, gegossen",Numismatik,um 1970
2360156,18208160,"Burgeff, Hans Karl: Martin Luther",,MKMedaillen20Jhbisheute1900bisheute,"Bronze, gegossen",Numismatik,1970
2360161,18208165,"Burgeff, Hans Karl: Erich Koellmann",,MKMedaillen20Jhbisheute1900bisheute,"Biskuitporzellan, modelliert",Numismatik,1971
2360165,18208169,"Burgeff, Hans Karl: Zeichnender (Leonardo da Vinci)",,MKMedaillen20Jhbisheute1900bisheute,"Silber, gegossen",Numismatik,1971
2360174,18208178,"Burgeff, Hans Karl: Igor Strawinsky",,MKMedaillen20Jhbisheute1900bisheute,"Bronze, gegossen",Numismatik,1972
2360177,18208181,"Burgeff, Hans Karl: Revolution",,MKMedaillen20Jhbisheute1900bisheute,"Bronze, gegossen",Numismatik,1972
2360181,18208186,"Burgeff, Hans Karl: Dank der Fachhochschule Köln I",,MKMedaillen20Jhbisheute1900bisheute,"Bronze, gegossen",Numismatik,1972
2360182,18208187,"Burgeff, Hans Karl: Schiff (Hochzeitsplakette)",,MKMedaillen20Jhbisheute1900bisheute,"Bronze, gegossen",Numismatik,um 1972
2360184,18208189,"Burgeff, Hans Karl: Pro Venetia II",,MKMedaillen20Jhbisheute1900bisheute,"Silber, geprägt",Numismatik,1973
2360187,18208192,"Burgeff, Hans Karl: Dr. Hans und Lelly Burgeff, Goldene Hochzeit",,MKMedaillen20Jhbisheute1900bisheute,"Bronze, gegossen",Numismatik,1973
2360192,18208198,"Burgeff, Hans Karl: Est modus in rebus I",,MKMedaillen20Jhbisheute1900bisheute,"Bronze, gegossen",Numismatik,1974
2360249,18208301,"Burgeff, Hans Karl: Erich Kock",,MKMedaillen20Jhbisheute1900bisheute,"Bronze, gegossen",Numismatik,1974
2360252,18208304,"Burgeff, Hans Karl: Jubiläumsmedaille Mönchengladbach",,MKMedaillen20Jhbisheute1900bisheute,"Silber, geprägt",Numismatik,1974
2360254,18208306,"Burgeff, Hans Karl: Winterlandschaft",,MKMedaillen20Jhbisheute1900bisheute,"Biskuitporzellan, modelliert",Numismatik,1974
2360256,18208308,"Burgeff, Hans Karl: Offenbarungseid eines Lehrers",,MKMedaillen20Jhbisheute1900bisheute,"Bronze, gegossen",Numismatik,1975
2360261,18208313,"Burgeff, Hans Karl: Der Entworfene/Gezeichnete",,MKMedaillen20Jhbisheute1900bisheute,"Bronze, gegossen",Numismatik,1975
2360262,18208314,"Burgeff, Hans Karl: Carl Friedrich Gauss",,MKMedaillen20Jhbisheute1900bisheute,"Bronze, gegossen",Numismatik,1977
2360272,18208326,"Burgeff, Hans Karl: Carl Zuckmayer",,MKMedaillen20Jhbisheute1900bisheute,"Bronze, gegossen",Numismatik,1977
2360273,18208327,"Burgeff, Hans Karl: Dr. Hans Lauscher",,MKMedaillen20Jhbisheute1900bisheute,"Bronze, gegossen",Numismatik,1978
2360276,18208329,"Burgeff, Hans Karl: Irmgard Lauscher-Koch",,MKMedaillen20Jhbisheute1900bisheute,"Bronze, gegossen",Numismatik,1978
2360278,18208331,"Burgeff, Hans Karl: Muse und Muffel",,MKMedaillen20Jhbisheute1900bisheute,"Bronze, gegossen",Numismatik,um 1978
2360280,18208333,"Burgeff, Hans Karl: Aktaion in der Schule",,MKMedaillen20Jhbisheute1900bisheute,"Bronze, gegossen",Numismatik,um 1978
2360282,18208335,"Burgeff, Hans Karl: Dr. Kurt Hackenberg",,MKMedaillen20Jhbisheute1900bisheute,"Bronze, gegossen",Numismatik,1979
2360285,18208338,"Burgeff, Hans Karl: Ernst Reuter vor dem nächtlichen Berlin",,MKMedaillen20Jhbisheute1900bisheute,"Bronze, gegossen",Numismatik,1979
2360290,18208345,"Burgeff, Hans Karl: Eligiuspreis",,MKMedaillen20Jhbisheute1900bisheute,"Bronze, gegossen",Numismatik,1979
2360293,18208349,"Burgeff, Hans Karl: Tobias mit dem Fisch",,MKMedaillen20Jhbisheute1900bisheute,"Bronze, gegossen",Numismatik,1980
2360295,18208352,"Burgeff, Hans Karl: Zweihundert Jahre Universität Münster",,MKMedaillen20Jhbisheute1900bisheute,"Silber, geprägt",Numismatik,1980
2360298,18208357,"Burgeff, Hans Karl: Zweihundert Jahre Universität Münster",,MKMedaillen20Jhbisheute1900bisheute,"Bronze, gegossen",Numismatik,1980
2360302,18208364,"Burgeff, Hans Karl: Die verschreckten Äpfel",,MKMedaillen20Jhbisheute1900bisheute,"Bronze, gegossen",Numismatik,um 1980
2360304,18208366,"Burgeff, Hans Karl: Pellenz",,MKMedaillen20Jhbisheute1900bisheute,"Bronze, gegossen",Numismatik,um 1980
2360306,18208368,"Burgeff, Hans Karl: Tulpe am Fenster",,MKMedaillen20Jhbisheute1900bisheute,"Bronze, gegossen",Numismatik,um 1980
2360308,18208370,"Burgeff, Hans Karl: Tod und Mädchen im Zirkuswagen",,MKMedaillen20Jhbisheute1900bisheute,"Bronze, gegossen",Numismatik,1981
2360311,18208373,"Burgeff, Hans Karl: Hochzeitsplakette Elke und Martin Bohn",,MKMedaillen20Jhbisheute1900bisheute,"Bronze, gegossen",Numismatik,1982
2360313,18208375,"Burgeff, Hans Karl: Goethe",,MKMedaillen20Jhbisheute1900bisheute,"Bronze, gegossen",Numismatik,1982
2360315,18208377,"Burgeff, Hans Karl: Dr. Toni Feldenkirchen I",,MKMedaillen20Jhbisheute1900bisheute,"Bronze, gegossen",Numismatik,1982
2360318,18208380,"Burgeff, Hans Karl: Dr. Toni Feldenkirchen II",,MKMedaillen20Jhbisheute1900bisheute,"Bronze, gegossen",Numismatik,1982
2360320,18208382,"Burgeff, Hans Karl: Augenarztmedaille III",,MKMedaillen20Jhbisheute1900bisheute,"Bronze, gegossen",Numismatik,1983
2360323,18208385,"Burgeff, Hans Karl: Bundesrat",,MKMedaillen20Jhbisheute1900bisheute,"Tombak, geprägt",Numismatik,1984
2360324,18208386,"Burgeff, Hans Karl: 750 Jahre Limburger Dom",,MKMedaillen20Jhbisheute1900bisheute,"Silber, geprägt",Numismatik,1985
2360325,18208387,"Burgeff, Hans Karl: Winterblumenstrauss",,MKMedaillen20Jhbisheute1900bisheute,"Bronze, gegossen",Numismatik,um 1985
2360474,18208545,"Burgeff, Hans Karl: Ludwig Gies III",,MKMedaillen20Jhbisheute1900bisheute,"Eisen, gegossen",Numismatik,1987
2360476,18208548,"Burgeff, Hans Karl: Weihnachtsgruss",,MKMedaillen20Jhbisheute1900bisheute,"Bronze, gegossen",Numismatik,1987
2360477,18208549,"Burgeff, Hans Karl: Paul Haentjes",,MKMedaillen20Jhbisheute1900bisheute,"Bronze, gegossen",Numismatik,1987
